{
  "schema_version": "1.0",
  "slideId": "slide_05",
  "layoutId": "REQUIREMENTS_MATRIX_01",
  "sectionLabel": "REQUIREMENTS",
  "title": "Requirements mapping",
  "sourceChapterIds": ["5"],
  "fieldProvenance": [
    { "path": "sectionLabel", "sourceChapterIds": ["5"] },
    { "path": "title", "sourceChapterIds": ["5"] },
    { "path": "requirements[0].category", "sourceChapterIds": ["5"] },
    { "path": "requirements[0].title", "sourceChapterIds": ["5"] },
    { "path": "requirements[0].status", "sourceChapterIds": ["5"] },
    { "path": "requirements[1].category", "sourceChapterIds": ["5"] },
    { "path": "requirements[1].title", "sourceChapterIds": ["5"] },
    { "path": "requirements[1].status", "sourceChapterIds": ["5"] },
    { "path": "requirements[2].category", "sourceChapterIds": ["5"] },
    { "path": "requirements[2].title", "sourceChapterIds": ["5"] },
    { "path": "requirements[2].status", "sourceChapterIds": ["5"] },
    { "path": "requirements[3].category", "sourceChapterIds": ["5"] },
    { "path": "requirements[3].title", "sourceChapterIds": ["5"] },
    { "path": "requirements[3].status", "sourceChapterIds": ["5"] },
    { "path": "requirements[4].category", "sourceChapterIds": ["5"] },
    { "path": "requirements[4].title", "sourceChapterIds": ["5"] },
    { "path": "requirements[4].status", "sourceChapterIds": ["5"] },
    { "path": "requirements[5].category", "sourceChapterIds": ["5"] },
    { "path": "requirements[5].title", "sourceChapterIds": ["5"] },
    { "path": "requirements[5].status", "sourceChapterIds": ["5"] }
  ],
  "requirements": [
    { "category": "A", "title": "Invoice field extraction", "status": "included" },
    { "category": "B", "title": "Three-way matching", "status": "included" },
    { "category": "C", "title": "Duplicate detection", "status": "included" },
    { "category": "D", "title": "Approval cases", "status": "partial" },
    { "category": "E", "title": "Exception handling", "status": "partial" },
    { "category": "F", "title": "Supplier communication", "status": "later" }
  ]
}
